reviewer,rating,title,date,review
uguana11,5.0 顆星，最高 5 顆星,Good sound quality and stays snug in ears,2023年8月18日在美國評論,"I've used these headphones for a bit now, and have gone on a few runs with no issues having the sport buds fall out. It comes with a couple different size silicon cushions and I might have to test that out for improved comfort. The led battery indicator shows when the case is charged, and when the case is charging the headphones. The sound quality is good, but I'm admittedly not an audiophile, just someone that wants to listen to music while running."
Manu97,5.0 顆星，最高 5 顆星,Good quality,2023年8月18日在美國評論,"These have been my favorite airpods, I can use them every time, it's battery is so long that i have them almost all day long.What I like the most is that they adjust very good to my ear that it isolate all exterior sounds so I can hear my favorite music with no interruptions.The mic is very good and  one of them got a little wet the other day in the rain but still working perfect, so they are waterproof for real :)"
M,5.0 顆星，最高 5 顆星,Good sound quality and comfortable,2023年8月18日在美國評論,"I like these earbuds cause they are very comfortable and the sound quality was very surprisingIt hugs your ear instead of jamming it in the ear and works great while running and working outbattery wise, it's holding up 2 sessions at the gym without putting it in the casethe case feels well built and sturdyit was a breeze to connect it to my phone and using the touch features."
Laureen,5.0 顆星，最高 5 顆星,Amazing product,2023年8月17日在美國評論,I love these earphones. The sound is very clear and they connect very easily. They work from a distance. You should definitely get them. They come with a charging cable and you can change the top to your liking because they come in different sizes. Overall amazing product worth every penny!!
Tonny Marcio Feitosa do Nascimento,5.0 顆星，最高 5 顆星,long-lasting battery,2023年8月15日在美國評論,Very good sound quality and long battery life
Karolay,5.0 顆星，最高 5 顆星,Excellent audio,2023年8月15日在美國評論,"the headphones are easy and fast to charge, they have very good audio! I love it"
Tracey Dineen-Hutchins,5.0 顆星，最高 5 顆星,Great sound quality,2023年8月15日在美國評論,"I was looking for a spare pair to use when away from home. I liked the design so decided to give these a try. Glad I did. These are fantastic and stay in place so they are ideal for walking/hiking/running. Very comfortable. Sound quality is fantastic as well. I charged them once when I first received them and, even with frequent use, they hold a charge for a long time."
Asher O.,5.0 顆星，最高 5 顆星,Great value,2023年8月14日在美國評論,"Fits well, fully functional, looks good, comfortable, all at a great price"
I'Tavia,5.0 顆星，最高 5 顆星,Comfortable wear,2023年8月13日在美國評論,"Typically I struggle to connect any ear buds to my phone. However this was simply and easy. The product came with a charge of 92% so no need to wait for a charge and went straight into working out. These are comfortable around the ear, had slight adjustments to fit my tiny ear. Overall nice 👍"
Abhinay,5.0 顆星，最高 5 顆星,Nice wireless headphones.,2023年8月12日在美國評論,Good sound quality. Better battery life than most products. These are comfortable in ears and easily connectable to different devices
James008,5.0 顆星，最高 5 顆星,My kids love this,2023年8月12日在美國評論,"Works great!my kids love this bluetooth headphones, he used for his sports practice"
Bao Tran,5.0 顆星，最高 5 顆星,Sound great,2023年8月12日在美國評論,"Sound great, the connection is fast, feel comfortable when wearing."
LC_tech,5.0 顆星，最高 5 顆星,Exceptional Performance and Comfort,2023年8月12日在美國評論,"I've been using these Bluetooth Headphones Wireless Earbuds for a few days now, and I'm thoroughly impressed with their performance and comfort. These earbuds have truly elevated my listening experience to a whole new level.The sound quality is outstanding. The bass is deep and powerful, while the highs are crisp and clear. Whether I'm listening to my favorite music or taking calls, the sound is rich and immersive, providing an exceptional audio experience. The noise isolation feature is a game-changer – it effectively blocks out background noise, allowing me to fully immerse myself in my music.Battery life is impressive too. I can use the earbuds for an extended period without worrying about running out of charge. The charging case is compact and provides additional power on the go."
Christina,5.0 顆星，最高 5 顆星,Great set very comfortable!,2023年8月11日在美國評論,"Great, excellent noise canceling, great for somebody who likes to listen to music loud even through earbuds. They are perfect. Absolutely perfect. Very fast charging didn’t take very long to charge to hundred percent at all and after listening to them for almost 6 hours throughout the day I was only down to 93%. The over the ear is very comfortable so these are very easy to wear for long periods of time. They hooked up to my iPhone very easily no issues and didn’t need directions. Would definitely recommend to anyone who wants a solid set of earbuds!"
Lz,5.0 顆星，最高 5 顆星,Comfortable to wear all day,2023年8月11日在美國評論,"It is comfortable to wear them all day, these ear buds feels solidly built and the battery can last for a long time."
Shannon Hare,5.0 顆星，最高 5 顆星,Wireless Earbud Review,2023年8月11日在美國評論,"I ordered these wireless earbuds because I wanted earbuds that I wouldn’t have to worry about losing while I was working out or simply doing chores around the house. Let me tell you, there is no need to worry about them falling out. They stay on during the most rigorous of activities, even while playing sports.I also wanted earbuds that have a long battery life so I can listen to audiobooks while cleaning, cooking, and while doing other activities. These earbuds really fit the bill because they can be used for several hours before needing to recharge them. In addition, you can see how much battery life is remaining right on the charging case so that’s super helpful.I have not tested out their waterproof feature as of yet, so I can’t speak to that, but I can tell you that you won’t be disappointed if you purchase them. They have superior sound quality, are priced very affordably and they are super comfortable since the fit is customizable. I highly recommend these wireless earbuds."
Ryan dietz,5.0 顆星，最高 5 顆星,Great product,2023年8月11日在美國評論,These are wonderful headphones
Prudy,5.0 顆星，最高 5 顆星,Incredibly comfortable!,2023年8月10日在美國評論,I am pleasantly surprised at how incredibly comfortable these headphones are. The ear clips are soft yet secure and the headphones are so light that I forget I am wearing them. The sound is fantastic as well. I wear them all the time. I am so glad I purchased these. I highly recommend them for anyone who exercises or has a busy life.
Nathan,5.0 顆星，最高 5 顆星,Wife approved!,2023年8月10日在美國評論,My wife listens to ebooks constantly. I got all these headphones as her last set died. I wanted to try something relatively inexpensive that can handle the all day use that she requires. Overall so far these headphones seem to work perfectly for listening to ebooks. She just listens using one headphones at the time. Overall. So far so good!
Joey M,5.0 顆星，最高 5 顆星,Decent budget set,2023年8月10日在美國評論,"These work well if you need something for being on the move, they are comfortable and stay in your ears. The sound quality is ok. Don't expect these to sound like a $200 headphone because they are not. Over all good headset"
Ron,5.0 顆星，最高 5 顆星,Paired very easily.,2023年8月9日在美國評論,"Awesome, pairing is very easy, love it"
Steve Linegar,5.0 顆星，最高 5 顆星,Good quality product,2023年8月9日在美國評論,"I like the design, good sound quality and easy to use when I go to the gym, even if I'm running doesn't fall"
Charlotte Wilson,5.0 顆星，最高 5 顆星,Awesome earbuds!,2023年8月8日在美國評論,I really like the long battery feature. This brand does not take as long to charge as others ones I have. I also feel like the charge lasts longer. Great quality and clear sound. I also love the sleek case. It fits so comfortably in my computer bag.
Angie Mora,5.0 顆星，最高 5 顆星,Comfortable and great sound!,2023年8月8日在美國評論,"This earbuds are very comfortable and nice to wear for going for walks, hikes and jogging! They don’t fall at all which I love! The sound quality is very very good, and the battery life is also great! They come with their cable to charge, and also I really like that the case tells you how much battery is left. Highly recommend them!"
Liz D.,5.0 顆星，最高 5 顆星,I rarely have to worry about charging them,2023年8月8日在美國評論,"These Sports Earbuds offer a great 75-hour playtime, which means I rarely have to worry about charging them. The IPX7 waterproof rating is perfect for intense workouts, and the LED power display is a handy feature. The earhooks provide a secure fit, and the deep bass adds a fantastic dimension to my music during sports and running."
carlos sabrica,5.0 顆星，最高 5 顆星,Fit perfect,2023年8月8日在美國評論,"I love this earbuds, flexible and fit perfect in my ear, it is just perfect to run, and obviously the price is very good."
NakHyun Choi,5.0 顆星，最高 5 顆星,Very good~,2023年8月7日在美國評論,Bought for my son... the sound quality is good and everything is perfect
This product is awesome I received my earbuds today and I love them I have been totally unbothered today with my earbuds on,5.0 顆星，最高 5 顆星,Awesome Earbuds,2023年8月7日在美國評論,"I absolutely love my earbuds. Absolutely the best pair I’ve had in awhile, long lasting and short charge time is a plus with me."
Michelle Bryan,5.0 顆星，最高 5 顆星,"Finally! Great quality, waterproof ear buds!",2023年8月7日在美國評論,"I have been searching for a good quality, waterproof earbud to take with me on my morning runs, and finally, I’ve found it! High end sound, and they fit very comfortably in my ears and don’t fall out. I would definitely recommend this product!"
Mehmet KARAMAN,5.0 顆星，最高 5 顆星,Good Performance and Comfort,2023年8月7日在美國評論,"These earbuds have truly exceeded my expectations. The sound quality is outstanding, delivering rich bass and crisp highs. The wireless connectivity is seamless, providing hassle-free pairing. Additionally, the ergonomic design ensures a comfortable fit for prolonged use."
Mark,5.0 顆星，最高 5 顆星,A Soundtrack for Active Lifestyles - Unleash the Beat with These Incredible Bluetooth Earbuds!,2023年8月5日在美國評論,"I am absolutely thrilled with my purchase of the Bluetooth Headphones Wireless Earbuds! These earbuds have taken my workout experience to a whole new level and have quickly become my go-to companions for all things active.The impressive 75 hours of playtime means I can power through multiple workouts and even some extended outdoor adventures without worrying about recharging. The LED power display is a genius feature, ensuring that I'm always aware of how much juice I have left.The IPX7 waterproof rating has stood the test of rigorous workouts and even some unexpected rain showers. These earbuds are as tough as they come. The earhooks provide a secure fit that doesn't budge, no matter how intense my movements are.The deep bass and crystal-clear sound quality immerse me in my workout playlist like never before. Whether I'm hitting the pavement for a run or sweating it out in the gym, these earbuds deliver a powerful and motivating audio experience.I've also been pleasantly surprised by the convenience of the built-in microphone. Taking calls on the go has never been easier, and the in-ear design ensures that I can hear and be heard clearly."
Eric,5.0 顆星，最高 5 顆星,These are great,2023年8月5日在美國評論,I was looking for something noise canceling for work and these are great. They stay in place well and the features are easy to use
Matt,5.0 顆星，最高 5 顆星,Really good product,2023年8月5日在美國評論,"I really like this product, the voice quality is great and you can use it during running. Totally excellent!"
yeseniam,5.0 顆星，最高 5 顆星,It charge very fast,2023年8月4日在美國評論,"The best thing I like it is dual answering ports. It got long range , very stable , noise limited . Battery is excelente. Water proof caseI recommend this product"
Sailesh,5.0 顆星，最高 5 顆星,Reliable and very useful,2023年8月4日在美國評論,"I bought these for my workout sessions and general use and the price was really good. First off, they fit perfectly in my ears and do not fall off. Second off, I have only charged these once since I bought them. Granted I’ve only used them couple hours a day, but the battery percentage is still on 89, that’s very impressive. The sound quality is pretty good for the price that you’re paying. I’m satisfied overall."
Shabnam 😀😇🇺🇸,5.0 顆星，最高 5 顆星,Wireless head phones,2023年8月4日在美國評論,Perfect for people who have hearing aids as these stay out of your ear. Great battery life and does not take too long to charge. Very nicely made. Great quality for the money.
Jackie,5.0 顆星，最高 5 顆星,Comfortable and high quality sound,2023年8月3日在美國評論,"These wireless earphones are the best! So light and comfortable on the ear, allows me to complete my workout with the fear of losing one. Sound quality is perfect and the battery life won’t disappoint either!"
